A1: Model # | B1: Motor RPM | C1: Gearbox style | D1: Gearbox | E1: Drive Gear | F1: Driven Gear | G1: Total Ratio | H1: Max RPM | I1: Horse Power | J1: Table Dia | K1: Table Thickness | L1: Material Weight | M1: Material Min | N1: Material Max
A2: D-12 | B2: 1750 | C2: 218 | D2: 30 | E2: 19 | F2: 20 | G2: =IF(OR(E2<=0,D2<=0),"",F2/E2*D2) -> 31.578947368421051 | H2: =IF(OR(G2="", G2=0),"",B2/G2) -> 55.416666666666671 | I2: 0.5 | L2: 1000
A3: D-15 | B3: 1750 | C3: 218 | D3: 15 | E3: 19 | F3: 20 | G3: =IF(OR(E3<=0,D3<=0),"",F3/E3*D3) -> 15.789473684210526 | H3: =IF(OR(G3="", G3=0),"",B3/G3) -> 110.83333333333334 | I3: 0.5 | L3: 150 | M3: 0.01 | N3: 0.05
A4: D-15A | B4: 1750 | C4: 218 | D4: 10 | E4: 19 | F4: 20 | G4: =IF(OR(E4<=0,D4<=0),"",F4/E4*D4) -> 10.526315789473683 | H4: =IF(OR(G4="", G4=0),"",B4/G4) -> 166.25 | I4: 1 | L4: 150 | M4: 0.01 | N4: 0.05
A5: D-15HS | B5: 2500 | C5: 218 | D5: 10 | E5: 19 | F5: 20 | G5: =IF(OR(E5<=0,D5<=0),"",F5/E5*D5) -> 10.526315789473683 | H5: =IF(OR(G5="", G5=0),"",B5/G5) -> 237.5 | I5: 1 | M5: 0.01 | N5: 0.05
A6: D-16H | B6: 3432 | C6: gear motor | D6: 33 | E6: 19 | F6: 20 | G6: =IF(OR(E6<=0,D6<=0),"",F6/E6*D6) -> 34.736842105263158 | H6: =IF(OR(G6="", G6=0),"",B6/G6) -> 98.8 | I6: 0.25 | J6: 16 | K6: 0.125 | L6: 50 | M6: 1E-3 | N6: 0.02
A7: D-16V | B7: 3432 | C7: gear motor | D7: 33 | E7: 19 | F7: 20 | G7: =IF(OR(E7<=0,D7<=0),"",F7/E7*D7) -> 34.736842105263158 | H7: =IF(OR(G7="", G7=0),"",B7/G7) -> 98.8 | I7: 0.25 | L7: 50 | M7: 1E-3 | N7: 0.02
A8: D-17 | B8: 2244 | C8: 218 | D8: 33 | E8: 19 | F8: 20 | G8: =IF(OR(E8<=0,D8<=0),"",F8/E8*D8) -> 34.736842105263158 | H8: =IF(OR(G8="", G8=0),"",B8/G8) -> 64.6 | I8: 0.25 | J8: 26 | K8: 0.25 | L8: 150 | M8: 0.01 | N8: 0.05
A9: D-17HD | B9: 1750 | C9: 218 | D9: 20 | E9: 19 | F9: 24 | G9: =IF(OR(E9<=0,D9<=0),"",F9/E9*D9) -> 25.263157894736842 | H9: =IF(OR(G9="", G9=0),"",B9/G9) -> 69.270833333333329 | I9: 0.5 | J9: 32 | K9: 0.375 | L9: 500 | M9: 0.01 | N9: 0.05
A10: D-19 | B10: 1750 | C10: 218 | D10: 15 | E10: 19 | F10: 20 | G10: =IF(OR(E10<=0,D10<=0),"",F10/E10*D10) -> 15.789473684210526 | H10: =IF(OR(G10="", G10=0),"",B10/G10) -> 110.83333333333334 | I10: 0.5 | J10: 26 | K10: 0.25 | L10: 300 | M10: 0.01 | N10: 0.05
A11: D-19A | B11: 1750 | C11: 218 | D11: 15 | E11: 19 | F11: 20 | G11: =IF(OR(E11<=0,D11<=0),"",F11/E11*D11) -> 15.789473684210526 | H11: =IF(OR(G11="", G11=0),"",B11/G11) -> 110.83333333333334 | I11: 1 | J11: 26 | K11: 0.25 | L11: 300 | M11: 0.01 | N11: 0.05
A12: D-19HS | B12: 2500 | C12: 218 | D12: 15 | E12: 19 | F12: 20 | G12: =IF(OR(E12<=0,D12<=0),"",F12/E12*D12) -> 15.789473684210526 | H12: =IF(OR(G12="", G12=0),"",B12/G12) -> 158.33333333333334 | I12: 1 | J12: 26 | K12: 0.25 | M12: 0.01 | N12: 0.05
A13: D-20 | B13: 1750 | C13: 220 | D13: 20 | E13: 34 | F13: 36 | G13: =IF(OR(E13<=0,D13<=0),"",F13/E13*D13) -> 21.176470588235293 | H13: =IF(OR(G13="", G13=0),"",B13/G13) -> 82.638888888888886 | I13: 0.5 | L13: 1000 | M13: 0.01 | N13: 0.09
A14: D-20A | B14: 1750 | C14: 220 | D14: 10 | E14: 34 | F14: 36 | G14: =IF(OR(E14<=0,D14<=0),"",F14/E14*D14) -> 10.588235294117647 | H14: =IF(OR(G14="", G14=0),"",B14/G14) -> 165.27777777777777 | I14: 1 | L14: 1000 | M14: 0.01 | N14: 0.09
A15: D-20AHS | B15: 1750 | C15: 220 | D15: 10 | E15: 56 | F15: 56 | G15: =IF(OR(E15<=0,D15<=0),"",F15/E15*D15) -> 10.00 | H15: =IF(OR(G15="", G15=0),"",B15/G15) -> 175.0 | I15: 1.5 | L15: 1000 | M15: 0.01 | N15: 0.09
A16: D-25 | B16: 1750 | C16: 220 | D16: 20 | E16: 19 | F16: 20 | G16: =IF(OR(E16<=0,D16<=0),"",F16/E16*D16) -> 21.052631578947366 | H16: =IF(OR(G16="", G16=0),"",B16/G16) -> 83.125 | I16: 0.5 | J16: 32 | K16: 0.375 | L16: 1200 | M16: 0.01 | N16: 0.09
A17: D-25A | B17: 1750 | C17: 220 | D17: 15 | E17: 19 | F17: 20 | G17: =IF(OR(E17<=0,D17<=0),"",F17/E17*D17) -> 15.789473684210526 | H17: =IF(OR(G17="", G17=0),"",B17/G17) -> 110.83333333333334 | I17: 1 | J17: 32 | K17: 0.375 | L17: 1200 | M17: 0.01 | N17: 0.09
A18: D-25HS | B18: 2500 | C18: 220 | D18: 15 | E18: 19 | F18: 20 | G18: =IF(OR(E18<=0,D18<=0),"",F18/E18*D18) -> 15.789473684210526 | H18: =IF(OR(G18="", G18=0),"",B18/G18) -> 158.33333333333334 | I18: 1 | J18: 32 | K18: 0.375 | M18: 0.01 | N18: 0.09
A19: D-28 | B19: 1750 | C19: 220 | D19: 30 | E19: 17 | F19: 36 | G19: =IF(OR(E19<=0,D19<=0),"",F19/E19*D19) -> 63.529411764705884 | H19: =IF(OR(G19="", G19=0),"",B19/G19) -> 27.546296296296294 | I19: 0.5 | J19: 45 | K19: 0.375 | L19: 2000 | M19: 0.05 | N19: 0.25
A20: D-30 | B20: 1750 | C20: 220 | D20: 20 | E20: 15 | F20: 32 | G20: =IF(OR(E20<=0,D20<=0),"",F20/E20*D20) -> 42.666666666666664 | H20: =IF(OR(G20="", G20=0),"",B20/G20) -> 41.015625 | I20: 1 | J20: 45 | K20: 0.375 | L20: 3000 | M20: 0.05 | N20: 0.25
A21: D-30A | B21: 1750 | C21: 224 | D21: 20 | E21: 17 | F21: 32 | G21: =IF(OR(E21<=0,D21<=0),"",F21/E21*D21) -> 37.647058823529413 | H21: =IF(OR(G21="", G21=0),"",B21/G21) -> 46.484375 | I21: 1.5 | J21: 45 | K21: 0.375 | L21: 3000 | M21: 0.05 | N21: 0.25
A22: D-31 | B22: 1750 | C22: 220 | D22: 20 | E22: 15 | F22: 30 | G22: =IF(OR(E22<=0,D22<=0),"",F22/E22*D22) -> 40.00 | H22: =IF(OR(G22="", G22=0),"",B22/G22) -> 43.75 | I22: 1 | J22: 45 | K22: 0.375 | L22: 3000 | M22: 0.01 | N22: 0.09
A23: D-31A | B23: 1750 | C23: 224 | D23: 15 | E23: 15 | F23: 28 | G23: =IF(OR(E23<=0,D23<=0),"",F23/E23*D23) -> 28.00 | H23: =IF(OR(G23="", G23=0),"",B23/G23) -> 62.5 | I23: 1.5 | J23: 45 | K23: 0.375 | L23: 3000 | M23: 0.01 | N23: 0.09
A24: D-4 | B24: 1750 | C24: 220 | D24: 30 | E24: 20 | F24: 20 | G24: =IF(OR(E24<=0,D24<=0),"",F24/E24*D24) -> 30.00 | H24: =IF(OR(G24="", G24=0),"",B24/G24) -> 58.333333333333336 | I24: 0.5 | L24: 1000
A25: D-40 | B25: 1750 | C25: 232 | D25: 30 | E25: 15 | F25: 24 | G25: =IF(OR(E25<=0,D25<=0),"",F25/E25*D25) -> 48.00 | H25: =IF(OR(G25="", G25=0),"",B25/G25) -> 36.458333333333336 | I25: 2 | J25: 60 | K25: 0.5 | L25: 4000 | M25: 0.05 | N25: 0.375
A26: D-40A | B26: 1750 | C26: 232 | D26: 20 | E26: 15 | F26: 28 | G26: =IF(OR(E26<=0,D26<=0),"",F26/E26*D26) -> 37.333333333333336 | H26: =IF(OR(G26="", G26=0),"",B26/G26) -> 46.875 | I26: 3 | J26: 60 | K26: 0.5 | L26: 4000 | M26: 0.05 | N26: 0.375
A27: D-40HS | B27: 1750 | C27: 232 | D27: 20 | E27: 13 | F27: 18 | G27: =IF(OR(E27<=0,D27<=0),"",F27/E27*D27) -> 27.692307692307693 | H27: =IF(OR(G27="", G27=0),"",B27/G27) -> 63.194444444444443 | I27: 3 | J27: 60 | K27: 0.5 | L27: 4000 | M27: 0.05 | N27: 0.375
A28: D-41 | B28: 1750 | C28: 232 | D28: 30 | E28: 15 | F28: 20 | G28: =IF(OR(E28<=0,D28<=0),"",F28/E28*D28) -> 40.00 | H28: =IF(OR(G28="", G28=0),"",B28/G28) -> 43.75 | I28: 2 | J28: 60 | K28: 0.5 | L28: 4000 | M28: 0.01 | N28: 0.09
A29: D-41A | B29: 1750 | C29: 232 | D29: 20 | E29: 15 | F29: 24 | G29: =IF(OR(E29<=0,D29<=0),"",F29/E29*D29) -> 32.00 | H29: =IF(OR(G29="", G29=0),"",B29/G29) -> 54.6875 | I29: 3 | J29: 60 | K29: 0.5 | L29: 4000 | M29: 0.01 | N29: 0.09
A30: D-5 | B30: 1750 | C30: 220 | D30: 30 | E30: 20 | F30: 20 | G30: =IF(OR(E30<=0,D30<=0),"",F30/E30*D30) -> 30.00 | H30: =IF(OR(G30="", G30=0),"",B30/G30) -> 58.333333333333336 | I30: 0.5 | L30: 1000
A31: D-60 | B31: 1750 | C31: 242 | D31: 30 | E31: 15 | F31: 32 | G31: =IF(OR(E31<=0,D31<=0),"",F31/E31*D31) -> 64.00 | H31: =IF(OR(G31="", G31=0),"",B31/G31) -> 27.34375 | I31: 3 | J31: 72 | K31: 0.5 | L31: 6000 | M31: 0.05 | N31: 0.5
A32: D-60A | B32: 1750 | C32: 242 | D32: 20 | E32: 13 | F32: 32 | G32: =IF(OR(E32<=0,D32<=0),"",F32/E32*D32) -> 49.230769230769234 | H32: =IF(OR(G32="", G32=0),"",B32/G32) -> 35.546875 | I32: 5 | J32: 72 | K32: 0.5 | L32: 6000 | M32: 0.1 | N32: 0.5
A33: D-100 | B33: 1750 | C33: 252 | G33: =IF(OR(E33<=0,D33<=0),"",F33/E33*D33) ->  | H33: =IF(OR(G33="", G33=0),"",B33/G33) ->  | I33: 5
A34: D-105 | B34: 1750 | C34: 252 | D34: 40 | E34: 15 | F34: 32 | G34: =IF(OR(E34<=0,D34<=0),"",F34/E34*D34) -> 85.333333333333329 | H34: =IF(OR(G34="", G34=0),"",B34/G34) -> 20.5078125 | I34: 5 | J34: 72 | K34: 0.75 | L34: 6000
A35: D-107 | B35: 1750 | C35: 1525 | D35: 30 | E35: 15 | F35: 32 | G35: =IF(OR(E35<=0,D35<=0),"",F35/E35*D35) -> 64.00 | H35: =IF(OR(G35="", G35=0),"",B35/G35) -> 27.34375 | I35: 7.5 | J35: 72 | K35: 0.75 | L35: 6000
A36: D-110 | B36: 1750 | G36: =IF(OR(E36<=0,D36<=0),"",F36/E36*D36) ->  | H36: =IF(OR(G36="", G36=0),"",B36/G36) -> 
A37: D-115 | B37: 1750 | C37: 21000 | D37: 40 | E37: 15 | F37: 32 | G37: =IF(OR(E37<=0,D37<=0),"",F37/E37*D37) -> 85.333333333333329 | H37: =IF(OR(G37="", G37=0),"",B37/G37) -> 20.5078125 | I37: 15 | J37: 72 | K37: 1 | L37: 15000
A38: F-100 | B38: 1750 | C38: 220 | D38: 40 | E38: 15 | F38: 32 | G38: =IF(OR(E38<=0,D38<=0),"",F38/E38*D38) -> 85.333333333333329 | H38: =IF(OR(G38="", G38=0),"",B38/G38) -> 20.5078125 | I38: 0.5 | J38: 45 | K38: 0.375 | L38: 3500
A39: F-100AF | B39: 1750 | C39: 220 | D39: 40 | E39: 15 | F39: 32 | G39: =IF(OR(E39<=0,D39<=0),"",F39/E39*D39) -> 85.333333333333329 | H39: =IF(OR(G39="", G39=0),"",B39/G39) -> 20.5078125 | I39: 0.5 | J39: 45 | K39: 0.375 | L39: 3500
A40: F-17 | B40: 2244 | C40: 218 | D40: 33 | E40: 19 | F40: 20 | G40: =IF(OR(E40<=0,D40<=0),"",F40/E40*D40) -> 34.736842105263158 | H40: =IF(OR(G40="", G40=0),"",B40/G40) -> 64.6 | I40: 0.25 | J40: 26 | K40: 0.25 | L40: 150
A41: F-17HD | B41: 1750 | C41: 218 | D41: 20 | E41: 19 | F41: 24 | G41: =IF(OR(E41<=0,D41<=0),"",F41/E41*D41) -> 25.263157894736842 | H41: =IF(OR(G41="", G41=0),"",B41/G41) -> 69.270833333333329 | I41: 0.5 | J41: 32 | K41: 0.375 | L41: 500
A42: F-200 | B42: 1750 | C42: 226 | D42: 40 | E42: 15 | F42: 32 | G42: =IF(OR(E42<=0,D42<=0),"",F42/E42*D42) -> 85.333333333333329 | H42: =IF(OR(G42="", G42=0),"",B42/G42) -> 20.5078125 | I42: 1 | J42: 50 | K42: 0.5 | L42: 5500
A43: F-200AF | B43: 1750 | C43: 226 | D43: 40 | E43: 15 | F43: 32 | G43: =IF(OR(E43<=0,D43<=0),"",F43/E43*D43) -> 85.333333333333329 | H43: =IF(OR(G43="", G43=0),"",B43/G43) -> 20.5078125 | I43: 1 | J43: 50 | K43: 0.5 | L43: 5500
A44: F-300 | B44: 1750 | C44: 232 | D44: 40 | E44: 15 | F44: 32 | G44: =IF(OR(E44<=0,D44<=0),"",F44/E44*D44) -> 85.333333333333329 | H44: =IF(OR(G44="", G44=0),"",B44/G44) -> 20.5078125 | I44: 1.5 | J44: 60 | K44: 0.5 | L44: 7000
A45: F-300AF | B45: 1750 | C45: 232 | D45: 40 | E45: 15 | F45: 32 | G45: =IF(OR(E45<=0,D45<=0),"",F45/E45*D45) -> 85.333333333333329 | H45: =IF(OR(G45="", G45=0),"",B45/G45) -> 20.5078125 | I45: 1.5 | J45: 60 | K45: 0.5 | L45: 7000
A46: F-302 | B46: 1750 | C46: 232 | D46: 30 | E46: 15 | F46: 32 | G46: =IF(OR(E46<=0,D46<=0),"",F46/E46*D46) -> 64.00 | H46: =IF(OR(G46="", G46=0),"",B46/G46) -> 27.34375 | I46: 2 | J46: 60 | K46: 0.5 | L46: 7000
A47: F-302AF | B47: 1750 | C47: 232 | D47: 40 | E47: 15 | F47: 32 | G47: =IF(OR(E47<=0,D47<=0),"",F47/E47*D47) -> 85.333333333333329 | H47: =IF(OR(G47="", G47=0),"",B47/G47) -> 20.5078125 | I47: 2 | J47: 60 | K47: 0.5 | L47: 7000
A48: F-303 | B48: 1750 | C48: 232 | D48: 30 | E48: 15 | F48: 32 | G48: =IF(OR(E48<=0,D48<=0),"",F48/E48*D48) -> 64.00 | H48: =IF(OR(G48="", G48=0),"",B48/G48) -> 27.34375 | I48: 3 | J48: 60 | K48: 0.5
A49: F-400 | B49: 1750 | C49: 242 | D49: 40 | E49: 13 | F49: 28 | G49: =IF(OR(E49<=0,D49<=0),"",F49/E49*D49) -> 86.153846153846146 | H49: =IF(OR(G49="", G49=0),"",B49/G49) -> 20.3125 | I49: 2 | J49: 72 | K49: 0.75 | L49: 9000
A50: F-400AF | B50: 1750 | C50: 242 | D50: 40 | E50: 15 | F50: 32 | G50: =IF(OR(E50<=0,D50<=0),"",F50/E50*D50) -> 85.333333333333329 | H50: =IF(OR(G50="", G50=0),"",B50/G50) -> 20.5078125 | I50: 3 | J50: 72 | K50: 0.75 | L50: 9000
A51: F-403 | B51: 1750 | C51: 242 | D51: 30 | E51: 15 | F51: 32 | G51: =IF(OR(E51<=0,D51<=0),"",F51/E51*D51) -> 64.00 | H51: =IF(OR(G51="", G51=0),"",B51/G51) -> 27.34375 | I51: 3 | J51: 72 | K51: 0.75 | L51: 9000
A52: F-405 | B52: 1750 | C52: 242 | D52: 30 | E52: 15 | F52: 32 | G52: =IF(OR(E52<=0,D52<=0),"",F52/E52*D52) -> 64.00 | H52: =IF(OR(G52="", G52=0),"",B52/G52) -> 27.34375 | I52: 5 | J52: 72 | K52: 0.75
A53: F-500 | B53: 1750 | C53: 242 | D53: 40 | E53: 15 | F53: 32 | G53: =IF(OR(E53<=0,D53<=0),"",F53/E53*D53) -> 85.333333333333329 | H53: =IF(OR(G53="", G53=0),"",B53/G53) -> 20.5078125 | I53: 3 | J53: 72 | K53: 1 | L53: 15000
A54: F-500AF | B54: 1750 | C54: 242 | D54: 40 | E54: 15 | F54: 32 | G54: =IF(OR(E54<=0,D54<=0),"",F54/E54*D54) -> 85.333333333333329 | H54: =IF(OR(G54="", G54=0),"",B54/G54) -> 20.5078125 | I54: 3 | J54: 72 | K54: 1 | L54: 15000
A55: F-505 | B55: 1750 | C55: 252 | D55: 30 | E55: 15 | F55: 32 | G55: =IF(OR(E55<=0,D55<=0),"",F55/E55*D55) -> 64.00 | H55: =IF(OR(G55="", G55=0),"",B55/G55) -> 27.34375 | I55: 5 | J55: 72 | K55: 1 | L55: 15000
A56: F-505AF | B56: 1750 | C56: 242 | D56: 40 | E56: 15 | F56: 32 | G56: =IF(OR(E56<=0,D56<=0),"",F56/E56*D56) -> 85.333333333333329 | H56: =IF(OR(G56="", G56=0),"",B56/G56) -> 20.5078125 | I56: 3 | J56: 72 | K56: 1 | L56: 15000
A57: F-507 | B57: 1750 | C57: 2600 | D57: 40 | E57: 15 | F57: 32 | G57: =IF(OR(E57<=0,D57<=0),"",F57/E57*D57) -> 85.333333333333329 | H57: =IF(OR(G57="", G57=0),"",B57/G57) -> 20.5078125 | I57: 7.5 | J57: 72 | K57: 1 | L57: 15000
A58: F-510 | B58: 1750 | C58: 2700 | D58: 40 | E58: 15 | F58: 32 | G58: =IF(OR(E58<=0,D58<=0),"",F58/E58*D58) -> 85.333333333333329 | H58: =IF(OR(G58="", G58=0),"",B58/G58) -> 20.5078125 | I58: 10 | J58: 72 | K58: 1 | L58: 15000
A59: F-515 | B59: 1750 | C59: 21000 | D59: 40 | G59: =IF(OR(E59<=0,D59<=0),"",F59/E59*D59) ->  | H59: =IF(OR(G59="", G59=0),"",B59/G59) ->  | I59: 15 | J59: 72 | K59: 1 | L59: 15000
A60: F-520 | B60: 1750 | C60: 21000 | D60: 40 | G60: =IF(OR(E60<=0,D60<=0),"",F60/E60*D60) ->  | H60: =IF(OR(G60="", G60=0),"",B60/G60) ->  | I60: 20 | J60: 72 | K60: 1 | L60: 15000
A61: F-525 | B61: 1750 | C61: 21000 | D61: 40 | G61: =IF(OR(E61<=0,D61<=0),"",F61/E61*D61) ->  | H61: =IF(OR(G61="", G61=0),"",B61/G61) ->  | I61: 25 | J61: 72 | K61: 1 | L61: 15000
A62: R-15 | B62: 1750 | C62: 218 | D62: 15 | E62: 19 | F62: 20 | G62: =IF(OR(E62<=0,D62<=0),"",F62/E62*D62) -> 15.789473684210526 | H62: =IF(OR(G62="", G62=0),"",B62/G62) -> 110.83333333333334 | I62: 0.5 | L62: 150 | M62: 0.01 | N62: 0.06
A63: R-15D | C63: 218 | G63: =IF(OR(E63<=0,D63<=0),"",F63/E63*D63) ->  | H63: =IF(OR(G63="", G63=0),"",B63/G63) -> 
A64: R-16 | B64: 1750 | C64: gear motor | D64: 20 | E64: 20 | F64: 20 | G64: =IF(OR(E64<=0,D64<=0),"",F64/E64*D64) -> 20.00 | H64: =IF(OR(G64="", G64=0),"",B64/G64) -> 87.5 | I64: 0.5 | L64: 40 | M64: 0.01 | N64: 0.06
A65: R-20 | B65: 1750 | C65: 220 | D65: 20 | E65: 20 | F65: 20 | G65: =IF(OR(E65<=0,D65<=0),"",F65/E65*D65) -> 20.00 | H65: =IF(OR(G65="", G65=0),"",B65/G65) -> 87.5 | I65: 0.5 | L65: 1000 | M65: 0.02 | N65: 0.1